title,genre,description
Matrix,Sci-Fi,Um hacker descobre que o mundo é uma simulação.
John Wick,Ação,Um assassino aposentado busca vingança.
Titanic,Romance,Um amor proibido a bordo do Titanic.
Avatar,Ficção Científica,Um soldado em um planeta alienígena.
Interestelar,Ficção Científica,Uma viagem no tempo e espaço em busca de um novo lar.
Vingadores,Ação,Heróis se unem para salvar o mundo.
O Rei Leão,Animação,Um leão enfrenta seu destino como rei.
Coringa,Drama,A origem sombria de um dos maiores vilões.
365 dias,Romance,Um amor proibido.